"Keyword","Location & Language","Monthly Search Volume","CPC","Competition"
"electricity grid","US, EN","5,400","4.49","Medium"
"electricity-grid","US, EN","5,400","4.49","Low"
"texas electricity grid","US, EN","3,600","13.90","Medium"
"national grid for electricity","US, EN","3,600","1.28","Medium"
"electricity national grid","US, EN","3,600","1.28","Medium"
"national grid electricity","US, EN","3,600","1.28","Medium"
"smart electricity grid","US, EN","2,900","19.16","Low"
"electricity grid us","US, EN","2,400","1.89","Medium"
"us electricity grid","US, EN","2,400","1.89","Medium"
"what is a electricity grid","US, EN","1,900","0.06","Low"
"what is grid electricity","US, EN","1,900","0.06","Low"
"what is electricity grid","US, EN","1,900","0.06","Low"
"what is grid in electricity","US, EN","1,900","0.06","Low"
"off grid electricity system","US, EN","1,600","2.43","Low"
"off grid electricity systems","US, EN","1,600","2.54","Low"
"off-grid electricity systems","US, EN","1,600","2.43","Low"
"off the grid electricity systems","US, EN","1,600","2.43","Low"
"map of electricity grid","US, EN","1,300","5.14","Low"
"electricity grid maps","US, EN","1,300","5.14","Low"
"electricity grid map","US, EN","1,300","5.14","Low"
"national grid massachusetts electricity","US, EN","1,300","0.53","Low"
"national grid electricity ma","US, EN","1,300","0.53","Low"
"us electricity grid map","US, EN","1,000","","Medium"
"grid electricity storage","US, EN","1,000","6.38","Medium"
"off the grid electricity solutions","US, EN","880","2.80","Low"
"the grid electricity","US, EN","720","13.01","Low"
"national grid contact number electricity","US, EN","720","15.90","Low"
"national grid electricity phone number","US, EN","720","15.90","Low"
"national grid electricity contact number","US, EN","720","15.90","Low"
"electricity off the grid","US, EN","720","1.79","Low"
"off the grid electricity","US, EN","720","1.79","Low"
"puerto rico electricity grid","US, EN","590","","Low"
"grid electricity","US, EN","590","2.38","Low"
"national grid electricity login","US, EN","590","0.99","Medium"
"national grid electricity pay bill","US, EN","480","1.79","Medium"
"how does the electricity grid work","US, EN","480","3.26","Low"
"national grid electricity price","US, EN","480","3.56","Low"
"national grid electricity rates","US, EN","480","3.56","Low"
"national grid electricity rate","US, EN","480","3.56","Low"
"off grid electricity generation","US, EN","480","2.34","Low"
"generating electricity off the grid","US, EN","480","2.34","Low"
"off grid electricity generator","US, EN","480","2.34","Low"
"off-grid electricity generation","US, EN","480","2.34","Low"
"electricity power grid","US, EN","390","","Low"
"electricity from the grid","US, EN","390","","Low"
"electricity from grid","US, EN","390","","Low"
"power grid electricity","US, EN","390","7.16","Low"
"grid in electricity","US, EN","390","7.16","Low"
"off grid solar electricity","US, EN","390","4.95","Low"
"electricity grid meaning","US, EN","320","","Low"